{
  "repertoire_version": 1,
  "unicode_version": "18.0.0",
  "ipa_chart": "2026",
  "base_symbols": [
    {
      "symbol": "a",
      "codepoints": ["U+0061"],
      "name": "LATIN SMALL LETTER A"
    },
    {
      "symbol": "b",
      "codepoints": ["U+0062"],
      "name": "LATIN SMALL LETTER B"
    },
    {
      "symbol": "c",
      "codepoints": ["U+0063"],
      "name": "LATIN SMALL LETTER C"
    },
    {
      "symbol": "d",
      "codepoints": ["U+0064"],
      "name": "LATIN SMALL LETTER D"
    },
    {
      "symbol": "e",
      "codepoints": ["U+0065"],
      "name": "LATIN SMALL LETTER E"
    },
    {
      "symbol": "f",
      "codepoints": ["U+0066"],
      "name": "LATIN SMALL LETTER F"
    },
    {
      "symbol": "h",
      "codepoints": ["U+0068"],
      "name": "LATIN SMALL LETTER H"
    },
    {
      "symbol": "i",
      "codepoints": ["U+0069"],
      "name": "LATIN SMALL LETTER I"
    },
    {
      "symbol": "j",
      "codepoints": ["U+006A"],
      "name": "LATIN SMALL LETTER J"
    },
    {
      "symbol": "k",
      "codepoints": ["U+006B"],
      "name": "LATIN SMALL LETTER K"
    },
    {
      "symbol": "l",
      "codepoints": ["U+006C"],
      "name": "LATIN SMALL LETTER L"
    },
    {
      "symbol": "m",
      "codepoints": ["U+006D"],
      "name": "LATIN SMALL LETTER M"
    },
    {
      "symbol": "n",
      "codepoints": ["U+006E"],
      "name": "LATIN SMALL LETTER N"
    },
    {
      "symbol": "o",
      "codepoints": ["U+006F"],
      "name": "LATIN SMALL LETTER O"
    },
    {
      "symbol": "p",
      "codepoints": ["U+0070"],
      "name": "LATIN SMALL LETTER P"
    },
    {
      "symbol": "q",
      "codepoints": ["U+0071"],
      "name": "LATIN SMALL LETTER Q"
    },
    {
      "symbol": "r",
      "codepoints": ["U+0072"],
      "name": "LATIN SMALL LETTER R"
    },
    {
      "symbol": "s",
      "codepoints": ["U+0073"],
      "name": "LATIN SMALL LETTER S"
    },
    {
      "symbol": "t",
      "codepoints": ["U+0074"],
      "name": "LATIN SMALL LETTER T"
    },
    {
      "symbol": "u",
      "codepoints": ["U+0075"],
      "name": "LATIN SMALL LETTER U"
    },
    {
      "symbol": "v",
      "codepoints": ["U+0076"],
      "name": "LATIN SMALL LETTER V"
    },
    {
      "symbol": "w",
      "codepoints": ["U+0077"],
      "name": "LATIN SMALL LETTER W"
    },
    {
      "symbol": "x",
      "codepoints": ["U+0078"],
      "name": "LATIN SMALL LETTER X"
    },
    {
      "symbol": "y",
      "codepoints": ["U+0079"],
      "name": "LATIN SMALL LETTER Y"
    },
    {
      "symbol": "z",
      "codepoints": ["U+007A"],
      "name": "LATIN SMALL LETTER Z"
    },
    {
      "symbol": "æ",
      "codepoints": ["U+00E6"],
      "name": "LATIN SMALL LETTER AE"
    },
    {
      "symbol": "ç",
      "codepoints": ["U+00E7"],
      "name": "LATIN SMALL LETTER C WITH CEDILLA"
    },
    {
      "symbol": "ð",
      "codepoints": ["U+00F0"],
      "name": "LATIN SMALL LETTER ETH"
    },
    {
      "symbol": "ø",
      "codepoints": ["U+00F8"],
      "name": "LATIN SMALL LETTER O WITH STROKE"
    },
    {
      "symbol": "ħ",
      "codepoints": ["U+0127"],
      "name": "LATIN SMALL LETTER H WITH STROKE"
    },
    {
      "symbol": "ŋ",
      "codepoints": ["U+014B"],
      "name": "LATIN SMALL LETTER ENG"
    },
    {
      "symbol": "œ",
      "codepoints": ["U+0153"],
      "name": "LATIN SMALL LIGATURE OE"
    },
    {
      "symbol": "ǀ",
      "codepoints": ["U+01C0"],
      "name": "LATIN LETTER DENTAL CLICK"
    },
    {
      "symbol": "ǁ",
      "codepoints": ["U+01C1"],
      "name": "LATIN LETTER LATERAL CLICK"
    },
    {
      "symbol": "ǂ",
      "codepoints": ["U+01C2"],
      "name": "LATIN LETTER ALVEOLAR CLICK"
    },
    {
      "symbol": "ǃ",
      "codepoints": ["U+01C3"],
      "name": "LATIN LETTER RETROFLEX CLICK"
    },
    {
      "symbol": "ɐ",
      "codepoints": ["U+0250"],
      "name": "LATIN SMALL LETTER TURNED A"
    },
    {
      "symbol": "ɑ",
      "codepoints": ["U+0251"],
      "name": "LATIN SMALL LETTER ALPHA"
    },
    {
      "symbol": "ɒ",
      "codepoints": ["U+0252"],
      "name": "LATIN SMALL LETTER TURNED ALPHA"
    },
    {
      "symbol": "ɓ",
      "codepoints": ["U+0253"],
      "name": "LATIN SMALL LETTER B WITH HOOK"
    },
    {
      "symbol": "ɔ",
      "codepoints": ["U+0254"],
      "name": "LATIN SMALL LETTER OPEN O"
    },
    {
      "symbol": "ɕ",
      "codepoints": ["U+0255"],
      "name": "LATIN SMALL LETTER C WITH CURL"
    },
    {
      "symbol": "ɖ",
      "codepoints": ["U+0256"],
      "name": "LATIN SMALL LETTER D WITH TAIL"
    },
    {
      "symbol": "ɗ",
      "codepoints": ["U+0257"],
      "name": "LATIN SMALL LETTER D WITH HOOK"
    },
    {
      "symbol": "ɘ",
      "codepoints": ["U+0258"],
      "name": "LATIN SMALL LETTER REVERSED E"
    },
    {
      "symbol": "ə",
      "codepoints": ["U+0259"],
      "name": "LATIN SMALL LETTER SCHWA"
    },
    {
      "symbol": "ɛ",
      "codepoints": ["U+025B"],
      "name": "LATIN SMALL LETTER OPEN E"
    },
    {
      "symbol": "ɜ",
      "codepoints": ["U+025C"],
      "name": "LATIN SMALL LETTER REVERSED OPEN E"
    },
    {
      "symbol": "ɞ",
      "codepoints": ["U+025E"],
      "name": "LATIN SMALL LETTER CLOSED REVERSED OPEN E"
    },
    {
      "symbol": "ɟ",
      "codepoints": ["U+025F"],
      "name": "LATIN SMALL LETTER DOTLESS J WITH STROKE"
    },
    {
      "symbol": "ɠ",
      "codepoints": ["U+0260"],
      "name": "LATIN SMALL LETTER G WITH HOOK"
    },
    {
      "symbol": "ɡ",
      "codepoints": ["U+0261"],
      "name": "LATIN SMALL LETTER SCRIPT G"
    },
    {
      "symbol": "ɢ",
      "codepoints": ["U+0262"],
      "name": "LATIN LETTER SMALL CAPITAL G"
    },
    {
      "symbol": "ɣ",
      "codepoints": ["U+0263"],
      "name": "LATIN SMALL LETTER GAMMA"
    },
    {
      "symbol": "ɤ",
      "codepoints": ["U+0264"],
      "name": "LATIN SMALL LETTER RAMS HORN"
    },
    {
      "symbol": "ɥ",
      "codepoints": ["U+0265"],
      "name": "LATIN SMALL LETTER TURNED H"
    },
    {
      "symbol": "ɦ",
      "codepoints": ["U+0266"],
      "name": "LATIN SMALL LETTER H WITH HOOK"
    },
    {
      "symbol": "ɧ",
      "codepoints": ["U+0267"],
      "name": "LATIN SMALL LETTER HENG WITH HOOK"
    },
    {
      "symbol": "ɨ",
      "codepoints": ["U+0268"],
      "name": "LATIN SMALL LETTER I WITH STROKE"
    },
    {
      "symbol": "ɪ",
      "codepoints": ["U+026A"],
      "name": "LATIN LETTER SMALL CAPITAL I"
    },
    {
      "symbol": "ɬ",
      "codepoints": ["U+026C"],
      "name": "LATIN SMALL LETTER L WITH BELT"
    },
    {
      "symbol": "ɭ",
      "codepoints": ["U+026D"],
      "name": "LATIN SMALL LETTER L WITH RETROFLEX HOOK"
    },
    {
      "symbol": "ɮ",
      "codepoints": ["U+026E"],
      "name": "LATIN SMALL LETTER LEZH"
    },
    {
      "symbol": "ɯ",
      "codepoints": ["U+026F"],
      "name": "LATIN SMALL LETTER TURNED M"
    },
    {
      "symbol": "ɰ",
      "codepoints": ["U+0270"],
      "name": "LATIN SMALL LETTER TURNED M WITH LONG LEG"
    },
    {
      "symbol": "ɱ",
      "codepoints": ["U+0271"],
      "name": "LATIN SMALL LETTER M WITH HOOK"
    },
    {
      "symbol": "ɲ",
      "codepoints": ["U+0272"],
      "name": "LATIN SMALL LETTER N WITH LEFT HOOK"
    },
    {
      "symbol": "ɳ",
      "codepoints": ["U+0273"],
      "name": "LATIN SMALL LETTER N WITH RETROFLEX HOOK"
    },
    {
      "symbol": "ɴ",
      "codepoints": ["U+0274"],
      "name": "LATIN LETTER SMALL CAPITAL N"
    },
    {
      "symbol": "ɵ",
      "codepoints": ["U+0275"],
      "name": "LATIN SMALL LETTER BARRED O"
    },
    {
      "symbol": "ɶ",
      "codepoints": ["U+0276"],
      "name": "LATIN LETTER SMALL CAPITAL OE"
    },
    {
      "symbol": "ɸ",
      "codepoints": ["U+0278"],
      "name": "LATIN SMALL LETTER PHI"
    },
    {
      "symbol": "ɹ",
      "codepoints": ["U+0279"],
      "name": "LATIN SMALL LETTER TURNED R"
    },
    {
      "symbol": "ɺ",
      "codepoints": ["U+027A"],
      "name": "LATIN SMALL LETTER TURNED R WITH LONG LEG"
    },
    {
      "symbol": "ɻ",
      "codepoints": ["U+027B"],
      "name": "LATIN SMALL LETTER TURNED R WITH HOOK"
    },
    {
      "symbol": "ɽ",
      "codepoints": ["U+027D"],
      "name": "LATIN SMALL LETTER R WITH TAIL"
    },
    {
      "symbol": "ɾ",
      "codepoints": ["U+027E"],
      "name": "LATIN SMALL LETTER R WITH FISHHOOK"
    },
    {
      "symbol": "ʀ",
      "codepoints": ["U+0280"],
      "name": "LATIN LETTER SMALL CAPITAL R"
    },
    {
      "symbol": "ʁ",
      "codepoints": ["U+0281"],
      "name": "LATIN LETTER SMALL CAPITAL INVERTED R"
    },
    {
      "symbol": "ʂ",
      "codepoints": ["U+0282"],
      "name": "LATIN SMALL LETTER S WITH HOOK"
    },
    {
      "symbol": "ʃ",
      "codepoints": ["U+0283"],
      "name": "LATIN SMALL LETTER ESH"
    },
    {
      "symbol": "ʄ",
      "codepoints": ["U+0284"],
      "name": "LATIN SMALL LETTER DOTLESS J WITH STROKE AND HOOK"
    },
    {
      "symbol": "ʈ",
      "codepoints": ["U+0288"],
      "name": "LATIN SMALL LETTER T WITH RETROFLEX HOOK"
    },
    {
      "symbol": "ʉ",
      "codepoints": ["U+0289"],
      "name": "LATIN SMALL LETTER U BAR"
    },
    {
      "symbol": "ʊ",
      "codepoints": ["U+028A"],
      "name": "LATIN SMALL LETTER UPSILON"
    },
    {
      "symbol": "ʋ",
      "codepoints": ["U+028B"],
      "name": "LATIN SMALL LETTER V WITH HOOK"
    },
    {
      "symbol": "ʌ",
      "codepoints": ["U+028C"],
      "name": "LATIN SMALL LETTER TURNED V"
    },
    {
      "symbol": "ʍ",
      "codepoints": ["U+028D"],
      "name": "LATIN SMALL LETTER TURNED W"
    },
    {
      "symbol": "ʎ",
      "codepoints": ["U+028E"],
      "name": "LATIN SMALL LETTER TURNED Y"
    },
    {
      "symbol": "ʏ",
      "codepoints": ["U+028F"],
      "name": "LATIN LETTER SMALL CAPITAL Y"